{
  "schema_version": "a2-l4-planner-output.v1",
  "task_id": "task-s2c1b-no-next-step",
  "workspace_root": "stack-code",
  "task_summary": "A write-intent candidate that proposes no operator next step.",
  "plan_steps": [
    { "step_id": "s1", "description": "Describe a bounded edit." }
  ],
  "risk_notes": [],
  "operator_next_steps": [],
  "patch_intent": {
    "summary": "Adjust a single bounded value.",
    "notes": ["Descriptive intent only."]
  }
}
