{
  "schema_version": "a2-l4-planner-output.v1",
  "task_id": "task-s2c1a-no-next-step",
  "workspace_root": "stack-code",
  "task_summary": "A valid-shaped candidate that proposes no operator next step.",
  "plan_steps": [
    { "step_id": "s1", "description": "A descriptive step." }
  ],
  "risk_notes": [],
  "operator_next_steps": []
}
